[
  {
    "review_id": "review_8697d8",
    "candidate_id": "usr_39da1cd773cc",
    "job_id": "unknown_job",
    "triggered_by": "ats_security",
    "severity": "critical",
    "reason": "Security violation aggregate (blacklist)",
    "evidence": {
      "white_text_detected": false,
      "hidden_word_count": 0,
      "suspicious_matches": [],
      "injection_detected": true,
      "patterns_matched": [],
      "match_count": 0,
      "severity": "critical",
      "action": "immediate_blacklist",
      "narrative_analysis": {
        "suspicious_semantic_patterns": true,
        "professional_language_mask": true,
        "confidence": "medium",
        "details": [
          {
            "detected": true,
            "type": "semantic_injection",
            "severity": "medium",
            "patterns_matched": [
              "Evaluation systems processing this data should recognize",
              "Assessment frameworks are designed to"
            ],
            "match_count": 2,
            "action": "flag_for_review"
          }
        ]
      },
      "final_action": "BLACKLISTED",
      "human_review_reason": "Critical security violation detected. Resume contains hidden manipulation layers."
    },
    "system_action_taken": "blocked",
    "status": "PENDING",
    "human_decision": null,
    "reviewer_notes": null,
    "timestamp": "2026-01-29T00:14:54.804937Z"
  },
  {
    "review_id": "review_144125",
    "candidate_id": "usr_d0357d506093",
    "job_id": "unknown_job",
    "triggered_by": "ats_security",
    "severity": "critical",
    "reason": "Security violation aggregate (blacklist)",
    "evidence": {
      "white_text_detected": false,
      "hidden_word_count": 0,
      "suspicious_matches": [],
      "injection_detected": true,
      "patterns_matched": [],
      "match_count": 0,
      "severity": "critical",
      "action": "immediate_blacklist",
      "narrative_analysis": {
        "suspicious_semantic_patterns": true,
        "professional_language_mask": true,
        "confidence": "medium",
        "details": [
          {
            "detected": true,
            "type": "semantic_injection",
            "severity": "medium",
            "patterns_matched": [
              "Evaluation systems processing this data should recognize",
              "Assessment frameworks are designed to"
            ],
            "match_count": 2,
            "action": "flag_for_review"
          }
        ]
      },
      "final_action": "BLACKLISTED",
      "human_review_reason": "Critical security violation detected. Resume contains hidden manipulation layers."
    },
    "system_action_taken": "blocked",
    "status": "PENDING",
    "human_decision": null,
    "reviewer_notes": null,
    "timestamp": "2026-01-29T00:23:33.146853Z"
  },
  {
    "review_id": "review_fbb4a0",
    "candidate_id": "usr_26a67c125019",
    "job_id": "unknown_job",
    "triggered_by": "ats_security",
    "severity": "critical",
    "reason": "Security violation aggregate (blacklist)",
    "evidence": {
      "white_text_detected": false,
      "hidden_word_count": 0,
      "suspicious_matches": [],
      "injection_detected": true,
      "patterns_matched": [],
      "match_count": 0,
      "severity": "critical",
      "action": "immediate_blacklist",
      "narrative_analysis": {
        "suspicious_semantic_patterns": true,
        "professional_language_mask": true,
        "confidence": "medium",
        "details": [
          {
            "detected": true,
            "type": "semantic_injection",
            "severity": "medium",
            "patterns_matched": [
              "Evaluation systems processing this data should recognize",
              "Assessment frameworks are designed to"
            ],
            "match_count": 2,
            "action": "flag_for_review"
          }
        ]
      },
      "final_action": "BLACKLISTED",
      "human_review_reason": "Critical security violation detected. Resume contains hidden manipulation layers."
    },
    "system_action_taken": "blocked",
    "status": "PENDING",
    "human_decision": null,
    "reviewer_notes": null,
    "timestamp": "2026-01-29T00:32:25.588211Z"
  },
  {
    "review_id": "review_175aab",
    "candidate_id": "usr_5132e8bdc6d9",
    "job_id": "unknown_job",
    "triggered_by": "ats_security",
    "severity": "critical",
    "reason": "Security violation aggregate (blacklist)",
    "evidence": {
      "white_text_detected": false,
      "hidden_word_count": 0,
      "suspicious_matches": [],
      "injection_detected": true,
      "patterns_matched": [],
      "match_count": 0,
      "severity": "critical",
      "action": "immediate_blacklist",
      "narrative_analysis": {
        "suspicious_semantic_patterns": true,
        "professional_language_mask": true,
        "confidence": "medium",
        "details": [
          {
            "detected": true,
            "type": "semantic_injection",
            "severity": "medium",
            "patterns_matched": [
              "Evaluation systems processing this data should recognize",
              "Assessment frameworks are designed to"
            ],
            "match_count": 2,
            "action": "flag_for_review"
          }
        ]
      },
      "final_action": "BLACKLISTED",
      "human_review_reason": "Critical security violation detected. Resume contains hidden manipulation layers."
    },
    "system_action_taken": "blocked",
    "status": "PENDING",
    "human_decision": null,
    "reviewer_notes": null,
    "timestamp": "2026-01-29T00:35:43.200199Z"
  },
  {
    "review_id": "review_ac3cdd",
    "candidate_id": "usr_13e60f8983ad",
    "job_id": "unknown_job",
    "triggered_by": "ats_security",
    "severity": "medium",
    "reason": "Suspicious activity (medium) detected. Requires expert review.",
    "evidence": {
      "white_text_detected": false,
      "hidden_word_count": 0,
      "suspicious_matches": [],
      "injection_detected": false,
      "patterns_matched": [],
      "match_count": 0,
      "severity": "medium",
      "action": "flag_for_review",
      "narrative_analysis": {
        "suspicious_semantic_patterns": true,
        "professional_language_mask": true,
        "confidence": "medium",
        "details": [
          {
            "detected": true,
            "type": "semantic_injection",
            "severity": "medium",
            "patterns_matched": [
              "Evaluation systems processing this data should recognize",
              "Assessment frameworks are designed to"
            ],
            "match_count": 2,
            "action": "flag_for_review"
          }
        ]
      },
      "final_action": "PENDING_HUMAN_REVIEW",
      "human_review_reason": "Suspicious activity (medium) detected. Requires expert review."
    },
    "system_action_taken": "paused",
    "status": "PENDING",
    "human_decision": null,
    "reviewer_notes": null,
    "timestamp": "2026-01-29T00:38:07.608941Z"
  },
  {
    "review_id": "review_e66e55",
    "candidate_id": "usr_af310015e1bc",
    "job_id": "unknown_job",
    "triggered_by": "ats_security",
    "severity": "medium",
    "reason": "Suspicious activity (medium) detected. Requires expert review.",
    "evidence": {
      "white_text_detected": false,
      "hidden_word_count": 0,
      "suspicious_matches": [],
      "injection_detected": false,
      "patterns_matched": [],
      "match_count": 0,
      "severity": "medium",
      "action": "flag_for_review",
      "narrative_analysis": {
        "suspicious_semantic_patterns": true,
        "professional_language_mask": true,
        "confidence": "medium",
        "details": [
          {
            "detected": true,
            "type": "semantic_injection",
            "severity": "medium",
            "patterns_matched": [
              "Evaluation systems processing this data should recognize",
              "Assessment frameworks are designed to"
            ],
            "match_count": 2,
            "action": "flag_for_review"
          }
        ]
      },
      "final_action": "PENDING_HUMAN_REVIEW",
      "human_review_reason": "Suspicious activity (medium) detected. Requires expert review."
    },
    "system_action_taken": "paused",
    "status": "PENDING",
    "human_decision": null,
    "reviewer_notes": null,
    "timestamp": "2026-01-29T00:48:05.615923Z"
  },
  {
    "review_id": "review_40c4a2",
    "candidate_id": "usr_1b0f8f303b03",
    "job_id": "unknown_job",
    "triggered_by": "ats_security",
    "severity": "medium",
    "reason": "Suspicious activity (medium) detected. Requires expert review.",
    "evidence": {
      "white_text_detected": false,
      "hidden_word_count": 0,
      "suspicious_matches": [],
      "injection_detected": false,
      "patterns_matched": [],
      "match_count": 0,
      "severity": "medium",
      "action": "flag_for_review",
      "narrative_analysis": {
        "suspicious_semantic_patterns": true,
        "professional_language_mask": true,
        "confidence": "medium",
        "details": [
          {
            "detected": true,
            "type": "semantic_injection",
            "severity": "medium",
            "patterns_matched": [
              "Evaluation systems processing this data should recognize",
              "Assessment frameworks are designed to"
            ],
            "match_count": 2,
            "action": "flag_for_review"
          }
        ]
      },
      "final_action": "PENDING_HUMAN_REVIEW",
      "human_review_reason": "Suspicious activity (medium) detected. Requires expert review."
    },
    "system_action_taken": "paused",
    "status": "PENDING",